{"name": "django-sayit", "metadata_version": "2.0", "generator": "bdist_wheel (0.24.0)", "summary": "A data store for speeches and transcripts to make them searchable and pretty.", "run_requires": [{"requires": ["beautifulsoup4", "requests-cache"], "extra": "scraping"}, {"requires": ["psycopg2 (>=2.5.1,<2.6)", "pytz (>=2013d)", "six (>=1.4.1)", "Django (>=1.4.2,<1.8)", "Django-Select2 (>=4.2.2,<4.3)", "django-qmethod (==0.0.3)", "audioread (>=1.0.1)", "pyelasticsearch (>=0.6,<0.7)", "django-haystack (>=2.1,<2.2)", "django-bleach (>=0.2.1)", "mysociety-django-popolo (>=0.0.2)", "mysociety-django-sluggable (>=0.2.6)", "django-subdomain-instances (>=0.10.2)", "easy-thumbnails (>=2.1)", "unicode-slugify (==0.1.1)", "pyOpenSSL (==0.14)", "ndg-httpsclient (==0.3.2)", "pyasn1 (==0.1.7)"]}, {"requires": ["selenium", "mock", "django-nose (==1.2)", "Mutagen", "lxml", "python-dateutil (<2)"], "extra": "test"}, {"requires": ["flake8", "django-debug-toolbar", "South (==1.0)", "popit-django (==0.0.3)"], "extra": "develop"}], "version": "1.3", "extensions": {"python.details": {"project_urls": {"Home": "https://github.com/mysociety/sayit"}, "document_names": {"description": "DESCRIPTION.rst"}, "contacts": [{"role": "author", "email": "sayit@mysociety.org", "name": "mySociety"}]}}, "classifiers": ["Development Status :: 5 - Production/Stable", "Environment :: Web Environment", "Framework :: Django", "License :: OSI Approved :: GNU Affero General Public License v3", "Intended Audience :: Developers", "Programming Language :: Python", "Programming Language :: Python :: 2", "Programming Language :: Python :: 3", "Topic :: Database :: Front-Ends", "Topic :: Internet :: WWW/HTTP"], "extras": ["develop", "scraping", "test"]}