{"license": "BSD", "name": "splash", "metadata_version": "2.0", "generator": "bdist_wheel (0.24.0)", "summary": "A javascript rendered with a HTTP API", "run_requires": [{"requires": ["Twisted", "qt4reactor", "psutil", "adblockparser", "xvfbwrapper"]}], "version": "1.2", "extensions": {"python.details": {"project_urls": {"Home": "https://github.com/scrapinghub/splash"}, "document_names": {"description": "DESCRIPTION.rst"}, "contacts": [{"role": "author", "email": "info@scrapinghub.com", "name": "Scrapinghub"}]}}, "classifiers": ["Programming Language :: Python", "Programming Language :: Python :: 2", "Programming Language :: Python :: 2.7", "License :: OSI Approved :: BSD License", "Operating System :: OS Independent", "Development Status :: 5 - Production/Stable", "Environment :: Console", "Environment :: No Input/Output (Daemon)", "Topic :: Internet :: WWW/HTTP"], "extras": []}