{"version": "1.1.7", "summary": "Simple app for automatization of everything", "metadata_version": "2.0", "run_requires": [{"requires": ["sloth-ci.ext.logs"], "extra": "Logs"}, {"requires": ["CherryPy", "awesome-slugify", "docopt", "tabulate", "PyYAML", "requests", "Routes"]}], "extensions": {"python.commands": {"wrap_console": {"sloth-ci": "sloth_ci.cli:main"}}, "python.details": {"contacts": [{"email": "moigagoo@live.com", "name": "Konstantin Molchanov", "role": "author"}], "document_names": {"description": "DESCRIPTION.rst"}, "project_urls": {"Home": "https://bitbucket.org/moigagoo/sloth-ci"}}, "python.exports": {"console_scripts": {"sloth-ci": "sloth_ci.cli:main"}}}, "name": "sloth-ci", "generator": "bdist_wheel (0.24.0)", "classifiers": ["Development Status :: 5 - Production/Stable", "Intended Audience :: Developers", "Natural Language :: English", "Programming Language :: Python", "Programming Language :: Python :: 3", "Programming Language :: Python :: 3.3", "Programming Language :: Python :: 3.4", "Programming Language :: Python :: 3 :: Only", "Operating System :: Microsoft :: Windows", "Operating System :: Unix", "Framework :: CherryPy"], "license": "MIT", "extras": ["Logs"]}