{"generator": "bdist_wheel (0.24.0)", "summary": "A simple Django package for model translations", "extensions": {"python.details": {"project_urls": {"Home": "https://github.com/esistgut/django-content-toolkit"}, "document_names": {"description": "DESCRIPTION.rst"}, "contacts": [{"email": "g.graziosi@gmail.com", "role": "author", "name": "Giacomo Graziosi"}]}}, "name": "django-content-toolkit", "license": "MIT", "version": "0.1.3", "run_requires": [{"requires": ["Django", "django-polymorphic", "django-reversion", "django-mptt", "django-taggit"]}], "extras": [], "metadata_version": "2.0", "classifiers": ["Environment :: Web Environment", "Framework :: Django", "Intended Audience :: Developers", "Operating System :: OS Independent", "Programming Language :: Python", "Programming Language :: Python :: 3", "Programming Language :: Python :: 3.4", "Topic :: Internet :: WWW/HTTP", "Topic :: Internet :: WWW/HTTP :: Dynamic Content"]}