{"generator": "bdist_wheel (0.24.0)", "classifiers": ["Programming Language :: Python", "Programming Language :: Python :: 3"], "metadata_version": "2.0", "summary": "Coverage report reading util", "extensions": {"python.details": {"project_urls": {"Home": "https://github.com/frigg/frigg-coverage"}, "contacts": [{"role": "author", "name": "The frigg team", "email": "hi@frigg.io"}], "document_names": {"description": "DESCRIPTION.rst"}}}, "name": "frigg-coverage", "version": "0.4.0", "extras": [], "run_requires": [{"requires": ["lxml"]}], "license": "MIT"}