{"license": "Apache License, Version 2.0", "name": "cloudwatch-to-graphite", "metadata_version": "2.0", "generator": "bdist_wheel (0.24.0)", "summary": "Helper for pushing AWS CloudWatch metrics to Graphite", "run_requires": [{"requires": ["boto", "PyYAML", "docopt", "Jinja2"]}], "version": "0.3.0", "extensions": {"python.details": {"project_urls": {"Home": "https://github.com/crccheck/cloudwatch-to-graphite"}, "document_names": {"description": "DESCRIPTION.rst"}, "contacts": [{"role": "author", "email": "c@crccheck.com", "name": "Chris Chang"}]}, "python.commands": {"wrap_console": {"leadbutt": "leadbutt:main", "plumbum": "plumbum:main"}}, "python.exports": {"console_scripts": {"leadbutt": "leadbutt:main", "plumbum": "plumbum:main"}}}, "classifiers": ["Development Status :: 3 - Alpha", "Environment :: Web Environment", "Intended Audience :: Developers", "License :: OSI Approved :: Apache Software License", "Operating System :: OS Independent", "Programming Language :: Python :: 2", "Programming Language :: Python :: 2.7", "Programming Language :: Python :: 3", "Programming Language :: Python :: 3.4"], "extras": []}