{"version": "0.2.1", "metadata_version": "2.0", "test_requires": [{"requires": ["mock", "pathlib"]}], "extras": [], "classifiers": ["Framework :: Buildout", "Intended Audience :: Developers", "License :: OSI Approved :: GNU General Public License (GPL)", "Topic :: Software Development :: Libraries :: Ruby Modules", "Programming Language :: Python :: 2", "Programming Language :: Python :: 3"], "summary": "zc.buildout recipe for installing ruby gems.", "license": "GPL", "generator": "bdist_wheel (0.24.0)", "name": "rubygemsrecipe", "run_requires": [{"requires": ["six", "zc.buildout", "setuptools", "hexagonit.recipe.download"]}], "extensions": {"python.details": {"project_urls": {"Home": "https://bitbucket.org/sirex/rubygemsrecipe"}, "contacts": [{"name": "Mantas Zimnickas", "email": "sirexas@gmail.com", "role": "author"}], "document_names": {"description": "DESCRIPTION.rst"}}, "python.exports": {"zc.buildout": {"default": "rubygems:Recipe"}}}}