{"test_requires": [{"requires": ["scipy (>=0.10.1)", "hacking (>=0.9.2,<0.10)", "coverage (>=3.6)", "discover", "python-subunit", "sphinx (>=1.1.2)", "oslosphinx", "oslotest (>=1.1.0.0a2)", "testrepository (>=0.0.18)", "testscenarios (>=0.4)", "testtools (>=0.9.34)", "numpydoc (>=0.5)", "sphinx-rtd-theme (>=0.1.6)", "flake8 (>=2.1.0)", "Cython (>=0.19)"]}], "generator": "bdist_wheel (0.24.0)", "extras": [], "run_requires": [{"requires": ["pbr (>=0.6,!=0.7,<1.0)", "numpy (>=1.6.1,<2.0)"]}], "metadata_version": "2.0", "version": "0.3.2", "name": "lda", "extensions": {"python.details": {"contacts": [{"name": "lda developers", "email": "lda-users@googlegroups.com", "role": "author"}], "document_names": {"description": "DESCRIPTION.rst"}}}, "summary": "Topic modeling with latent Dirichlet allocation", "classifiers": ["Development Status :: 4 - Beta", "Intended Audience :: Information Technology", "Intended Audience :: Developers", "Intended Audience :: Science/Research", "License :: OSI Approved :: Mozilla Public License 2.0 (MPL 2.0)", "Programming Language :: C", "Programming Language :: Cython", "Programming Language :: Python", "Programming Language :: Python :: 2", "Programming Language :: Python :: 3", "Operating System :: MacOS", "Operating System :: Microsoft :: Windows", "Operating System :: POSIX", "Operating System :: Unix"]}