{"name": "poker", "summary": "Poker Framework", "test_requires": [{"requires": ["pytest", "coverage", "coveralls"]}], "classifiers": ["Intended Audience :: Developers", "Programming Language :: Python", "Programming Language :: Python :: 3", "Programming Language :: Python :: 3.4"], "generator": "bdist_wheel (0.24.0)", "license": "MIT", "extensions": {"python.commands": {"wrap_console": {"poker": "poker.scripts:poker"}}, "python.exports": {"console_scripts": {"poker": "poker.scripts:poker"}}, "python.details": {"contacts": [{"name": "Kiss Gy\u00f6rgy", "email": "kissgyorgy@me.com", "role": "author"}], "project_urls": {"Home": "https://github.com/pokerregion/poker"}, "document_names": {"description": "DESCRIPTION.rst"}}}, "metadata_version": "2.0", "run_requires": [{"requires": ["pytz", "requests", "lxml", "python-dateutil", "parsedatetime", "cached-property", "click", "enum34-custom"]}], "version": "0.18.0", "keywords": ["poker"], "extras": []}