{"generator": "bdist_wheel (0.24.0)", "extensions": {"python.details": {"document_names": {"description": "DESCRIPTION.rst"}, "project_urls": {"Home": "http://github.com/relekang/rmoq"}, "contacts": [{"name": "Rolf Erik Lekang", "email": "me@rolflekang.com", "role": "author"}]}}, "summary": "A simple request-mocker that will download", "classifiers": ["Programming Language :: Python", "Programming Language :: Python :: 2.7", "Programming Language :: Python :: 3.4"], "metadata_version": "2.0", "name": "rmoq", "license": "MIT", "version": "0.2.1"}