{"license": "Apache 2.0", "name": "model-mommy", "metadata_version": "2.0", "generator": "bdist_wheel (0.24.0)", "test_requires": [{"requires": ["django (<1.8)", "pil", "tox"]}], "summary": "Smart object creation facility for Django.", "run_requires": [{"requires": ["Django (<1.8)", "six (==1.7.3)"]}], "version": "1.2.2", "extensions": {"python.details": {"project_urls": {"Home": "http://github.com/vandersonmota/model_mommy"}, "document_names": {"description": "DESCRIPTION.rst"}, "contacts": [{"role": "author", "email": "vandersonmota@gmail.com", "name": "vandersonmota"}]}}, "keywords": ["django", "testing", "factory", "python"], "classifiers": ["Framework :: Django", "Intended Audience :: Developers", "License :: OSI Approved :: Apache Software License", "Operating System :: OS Independent", "Topic :: Software Development", "Programming Language :: Python :: 2", "Programming Language :: Python :: 2.7", "Programming Language :: Python :: 3", "Programming Language :: Python :: 3.3"], "extras": []}