{"metadata_version": "2.0", "name": "monasca-persister", "test_requires": [{"requires": ["hacking (>=0.9.2,<0.10)", "pyflakes", "nose", "mock (>=1.0.1)"]}], "version": "0.1.4", "license": "Apache", "extras": [], "generator": "bdist_wheel (0.24.0)", "run_requires": [{"requires": ["babel", "iso8601", "eventlet", "kafka-python (>=0.9.1)", "oslo.config (>=1.3.0)", "influxdb (>=0.1.12)"]}], "extensions": {"python.commands": {"wrap_console": {"monasca-persister": "monasca_persister.servicerunner:main"}}, "python.exports": {"console_scripts": {"monasca-persister": "monasca_persister.servicerunner:main"}}, "python.details": {"contacts": [{"email": "deklan.dieterly@hp.com", "name": "Deklan Dieterly", "role": "author"}], "project_urls": {"Home": "https://github.com/stackforge/monasca-persister"}, "document_names": {"description": "DESCRIPTION.rst"}}}, "summary": "UNKNOWN", "keywords": ["openstack", "monitoring", "storage"], "classifiers": ["Development Status :: 5 - Production/Stable", "License :: OSI Approved :: Apache Software License", "Topic :: System :: Monitoring"]}