{"license": "MIT", "document_names": {"description": "DESCRIPTION.rst"}, "name": "pelican-publications", "metadata_version": "2.0", "contacts": [{"role": "author", "email": "adreeve@gmail.com", "name": "Adam Reeve"}], "generator": "bdist_wheel (0.23.0)", "summary": "A Pelican plugin that adds an RST directive for including a BibTeX publication list.", "project_urls": {"Home": "https://github.com/adamreeve/pelican_publications"}, "run_requires": [{"requires": ["bibtexparser"]}], "version": "0.2.0", "classifiers": ["Development Status :: 3 - Alpha", "Operating System :: OS Independent", "Programming Language :: Python", "Programming Language :: Python :: 2", "Programming Language :: Python :: 3", "Programming Language :: Python :: 2.6", "Programming Language :: Python :: 2.7", "Programming Language :: Python :: 3.2", "Programming Language :: Python :: 3.3", "Programming Language :: Python :: 3.4", "License :: OSI Approved :: MIT License", "Natural Language :: English", "Intended Audience :: Developers", "Topic :: Internet :: WWW/HTTP", "Topic :: Software Development :: Libraries :: Python Modules", "Topic :: Text Processing"], "extras": []}