{"keywords": ["fso", "freespace"], "generator": "bdist_wheel (0.24.0)", "summary": "A simple mod manager for FreeSpace 2 Open", "name": "knossos", "metadata_version": "2.0", "extensions": {"python.commands": {"wrap_gui": {"knossos": "knossos.launcher:main"}}, "python.details": {"project_urls": {"Home": "https://github.com/ngld/knossos"}, "document_names": {"description": "DESCRIPTION.rst"}, "contacts": [{"role": "author", "name": "ngld", "email": "ngld@tproxy.de"}]}, "python.exports": {"gui_scripts": {"knossos": "knossos.launcher:main"}}}, "classifiers": ["Development Status :: 3 - Alpha", "Intended Audience :: End Users/Desktop", "License :: OSI Approved :: Apache Software License", "Programming Language :: Python :: 2", "Programming Language :: Python :: 2.7", "Programming Language :: Python :: 3", "Programming Language :: Python :: 3.2", "Programming Language :: Python :: 3.3", "Programming Language :: Python :: 3.4"], "extras": ["pyqt4", "pyside"], "run_requires": [{"requires": ["six", "requests", "semantic-version"]}, {"extra": "pyqt4", "requires": ["PyQt4"]}, {"extra": "pyside", "requires": ["PySide"]}], "version": "0.1.0.dev3"}