{"name": "Beetle", "license": "MIT", "run_requires": [{"requires": ["PyYAML", "awesome-slugify", "Jinja2"]}], "extensions": {"python.commands": {"wrap_console": {"beetle": "beetle.cli:main"}}, "python.exports": {"console_scripts": {"beetle": "beetle.cli:main"}}, "python.details": {"contacts": [{"name": "Esben Sonne", "email": "esbensonne+code@gmail.com", "role": "author"}], "document_names": {"description": "DESCRIPTION.rst"}, "project_urls": {"Home": "https://github.com/cknv/beetle"}}}, "extras": [], "generator": "bdist_wheel (0.24.0)", "version": "0.7.1", "summary": "Beetle is a simple static site generator", "metadata_version": "2.0", "classifiers": ["Development Status :: 3 - Alpha", "Environment :: Console", "Environment :: Web Environment", "Intended Audience :: Developers", "License :: OSI Approved :: MIT License", "Natural Language :: English", "Operating System :: OS Independent", "Programming Language :: Python :: 3", "Programming Language :: Python", "Topic :: Text Processing"]}