{"license": "BSD", "name": "sqlcop", "metadata_version": "2.0", "generator": "bdist_wheel (0.24.0)", "summary": "A cli tool to check and guard against anti-patterns", "run_requires": [{"requires": ["sqlparse (==0.1.14)", "memoized (==0.2)"]}], "version": "0.9.3", "extensions": {"python.details": {"project_urls": {"Home": "https://github.2ndsiteinc.com/kevin/sqlcop"}, "document_names": {"description": "DESCRIPTION.rst"}, "contacts": [{"role": "author", "email": "kevin@freshbooks.com", "name": "Kevin Qiu"}]}, "python.commands": {"wrap_console": {"sqlcop": "sqlcop.cli:main"}}, "python.exports": {"console_scripts": {"sqlcop": "sqlcop.cli:main"}}}, "keywords": ["sqlcop"], "classifiers": ["Development Status :: 2 - Pre-Alpha", "Intended Audience :: Developers", "License :: OSI Approved :: BSD License", "Natural Language :: English", "Programming Language :: Python :: 2", "Programming Language :: Python :: 2.6", "Programming Language :: Python :: 2.7"], "extras": []}