{"license": "MIT", "name": "SoftLayer", "metadata_version": "2.0", "generator": "bdist_wheel (0.24.0)", "summary": "A library for SoftLayer's API", "run_requires": [{"requires": ["six (>=1.7.0)", "prettytable (>=0.7.0)", "docopt (==0.6.1)", "requests"]}], "version": "3.3.1", "extensions": {"python.details": {"project_urls": {"Home": "http://github.com/softlayer/softlayer-python"}, "document_names": {"description": "DESCRIPTION.rst"}, "contacts": [{"role": "author", "email": "sldn@softlayer.com", "name": "SoftLayer Technologies, Inc."}]}, "python.commands": {"wrap_console": {"sl": "SoftLayer.CLI.core:main"}}, "python.exports": {"console_scripts": {"sl": "SoftLayer.CLI.core:main"}}}, "classifiers": ["Environment :: Console", "Environment :: Web Environment", "Intended Audience :: Developers", "Intended Audience :: System Administrators", "License :: OSI Approved :: MIT License", "Operating System :: OS Independent", "Topic :: Software Development :: Libraries :: Python Modules", "Programming Language :: Python :: 3", "Programming Language :: Python :: 3.3", "Programming Language :: Python :: 3.2", "Programming Language :: Python :: 2.7", "Programming Language :: Python :: 2.6", "Programming Language :: Python :: Implementation :: CPython", "Programming Language :: Python :: Implementation :: PyPy"], "extras": []}