{"metadata_version": "2.0", "extensions": {"python.details": {"document_names": {"description": "DESCRIPTION.rst"}, "contacts": [{"name": "Javier Santacruz", "email": "javier.santacruz.lc@gmail.com", "role": "author"}]}}, "classifiers": ["Topic :: Software Development :: Testing"], "summary": "HTTP and HTTPS testing server", "name": "httptestserver", "generator": "bdist_wheel (0.24.0)", "version": "0.1.1"}