{"extensions": {"python.details": {"contacts": [{"email": "admin@incuna.com", "name": "Incuna", "role": "author"}], "project_urls": {"Home": "https://github.com/incuna/django-user-management/"}, "document_names": {"description": "DESCRIPTION.rst"}}}, "summary": "User management model mixins and api views.", "metadata_version": "2.0", "generator": "bdist_wheel (0.24.0)", "run_requires": [{"extra": "avatar", "requires": ["django-imagekit (>=3.2)"]}, {"requires": ["djangorestframework (>=2.4.3,<3)", "incuna-mail (>=2.0.0,<3)"]}], "name": "django-user-management", "version": "3.0.0", "extras": ["avatar"]}