{"license": "MIT", "name": "pcf-decrypt", "metadata_version": "2.0", "generator": "bdist_wheel (0.24.0)", "test_requires": [{"requires": []}], "summary": "Decrypt encoded passwords in Cisco VPN pcf files.", "run_requires": [{"requires": ["six (>=1.8.0,<2.0.0)", "PyCrypto (>=2.6.1,<2.7.0)"]}], "version": "0.1.1", "extensions": {"python.details": {"project_urls": {"Home": "https://github.com/demosdemon/pcf_decrypt"}, "document_names": {"description": "DESCRIPTION.rst"}, "contacts": [{"role": "author", "email": "demosdemon@gmail.com", "name": "Joachim Brandon LeBlanc"}]}, "python.commands": {"wrap_console": {"pcf_decrypt": "pcf_decrypt.__main__:main"}}, "python.exports": {"console_scripts": {"pcf_decrypt": "pcf_decrypt.__main__:main"}}}, "keywords": ["pcf_decrypt"], "classifiers": ["Development Status :: 4 - Beta", "Intended Audience :: Developers", "Intended Audience :: System Administrators", "License :: OSI Approved :: MIT License", "Natural Language :: English", "Programming Language :: Python :: 2", "Programming Language :: Python :: 2.6", "Programming Language :: Python :: 2.7", "Programming Language :: Python :: 3", "Programming Language :: Python :: 3.3", "Programming Language :: Python :: 3.4"], "extras": []}