{"license": "BSD", "name": "django-service-rating-store", "metadata_version": "2.0", "generator": "bdist_wheel (0.24.0)", "summary": "Django app that allows storage and visualisation of Service Rating data posted via REST API", "run_requires": [{"requires": ["Django", "django-tastypie", "South"]}], "version": "0.3.0", "extensions": {"python.details": {"project_urls": {"Home": "https://github.com/praekelt/django-service-rating-store"}, "document_names": {"description": "DESCRIPTION.rst"}, "contacts": [{"role": "author", "email": "devops@praekeltfoundation.org", "name": "Praekelt Foundation"}]}}, "classifiers": ["Development Status :: 4 - Beta", "Intended Audience :: Developers", "License :: OSI Approved :: BSD License", "Operating System :: POSIX", "Programming Language :: Python", "Topic :: Software Development :: Libraries :: Python Modules", "Topic :: System :: Networking"], "extras": []}