{"license": "BSD", "extras": [], "name": "bvg-grabber", "classifiers": ["Development Status :: 4 - Beta", "Environment :: Console", "Intended Audience :: Developers", "License :: OSI Approved :: BSD License", "Operating System :: OS Independent", "Programming Language :: Python", "Programming Language :: Python :: 3"], "metadata_version": "2.0", "generator": "bdist_wheel (0.24.0)", "run_requires": [{"requires": ["beautifulsoup4 (>=4.2.1)", "python-dateutil (>=2.1)", "requests (>=1.2.3)", "six (>=1.3.0)"]}], "summary": "Querying the upcoming public transport departures in Berlin", "version": "0.1.0", "extensions": {"python.details": {"project_urls": {"Home": "https://github.com/Markush2010/bvg-grabber"}, "contacts": [{"name": "Christian Struck, Markus Holtermann", "role": "author"}], "document_names": {"description": "DESCRIPTION.rst"}}}}