{"license": "MIT", "name": "switchpayments", "metadata_version": "2.0", "generator": "bdist_wheel (0.24.0)", "summary": "SwitchPayments", "version": "0.1.0.dev1", "extensions": {"python.details": {"project_urls": {"Home": "https://pypi.python.org/pypi/test_pypi"}, "document_names": {"description": "DESCRIPTION.rst"}, "contacts": [{"role": "author", "email": "info@switchpayments.com", "name": "The Switch. Team"}]}}, "keywords": ["payment", "payments"], "classifiers": ["Development Status :: 3 - Alpha", "Intended Audience :: Developers", "Topic :: Software Development :: Libraries", "License :: OSI Approved :: MIT License", "Programming Language :: Python :: 2", "Programming Language :: Python :: 2.6", "Programming Language :: Python :: 2.7", "Programming Language :: Python :: 3", "Programming Language :: Python :: 3.2", "Programming Language :: Python :: 3.3", "Programming Language :: Python :: 3.4"]}