{"keywords": ["log", "monitoring", "tail"], "classifiers": ["Development Status :: 4 - Beta", "Programming Language :: Python :: 2.7", "Programming Language :: Python :: 3", "Programming Language :: Python :: 3.3", "Programming Language :: Python :: 3.4", "License :: OSI Approved :: BSD License", "Intended Audience :: Developers", "Operating System :: POSIX :: Linux"], "name": "tailon", "run_requires": [{"requires": ["tornado (>=4.0.2)", "sockjs-tornado (>=1.0.1)", "PyYAML (>=3.11)"]}], "extras": [], "license": "Revised BSD License", "generator": "bdist_wheel (0.24.0)", "extensions": {"python.details": {"project_urls": {"Home": "https://github.com/gvalkov/tailon"}, "document_names": {"description": "DESCRIPTION.rst"}, "contacts": [{"role": "author", "email": "georgi.t.valkov@gmail.com", "name": "Georgi Valkov"}]}, "python.exports": {"console_scripts": {"tailon": "tailon.main:main"}}, "python.commands": {"wrap_console": {"tailon": "tailon.main:main"}}}, "version": "0.3.0", "summary": "Webapp for looking at and searching through log files", "metadata_version": "2.0"}